{
  "event_id": "evt_AHU-4_20261001T110800",
  "device_id": "AHU-4",
  "zone": "Zone-4",
  "ts_start": "2026-10-01T11:05:00Z",
  "ts_detected": "2026-10-01T11:08:00Z",
  "method": "zscore",
  "score": 1.0,
  "severity": "HIGH",
  "signals": [
    {
      "key": "airflow_cfm",
      "value": 1779.0,
      "baseline": 2249.94,
      "z": -6.82
    },
    {
      "key": "supply_temp_c",
      "value": 13.81,
      "baseline": 15.97,
      "z": -2.45
    },
    {
      "key": "coil_dt_c",
      "value": 9.03,
      "baseline": 7.02,
      "z": 2.45
    },
    {
      "key": "co2_ppm",
      "value": 1203.0,
      "baseline": 1147.83,
      "z": 1.37
    },
    {
      "key": "power_kw",
      "value": 6.51,
      "baseline": 5.71,
      "z": 1.09
    }
  ],
  "rule_hits": [],
  "window": [
    {
      "device_id": "AHU-4",
      "zone": "Zone-4",
      "ts": "2026-10-01T10:50:00Z",
      "zone_temp_c": 23.02,
      "supply_temp_c": 14.89,
      "setpoint_c": 23.0,
      "humidity_pct": 55.1,
      "airflow_cfm": 2286.0,
      "fan_speed_pct": 75.0,
      "power_kw": 6.28,
      "occupancy": 21,
      "co2_ppm": 1142.0,
      "status": "ON",
      "outdoor_temp_c": 36.5
    },
    {
      "device_id": "AHU-4",
      "zone": "Zone-4",
      "ts": "2026-10-01T10:51:00Z",
      "zone_temp_c": 23.12,
      "supply_temp_c": 15.36,
      "setpoint_c": 23.0,
      "humidity_pct": 53.7,
      "airflow_cfm": 2258.0,
      "fan_speed_pct": 75.0,
      "power_kw": 6.0,
      "occupancy": 21,
      "co2_ppm": 1158.0,
      "status": "ON",
      "outdoor_temp_c": 36.4
    },
    {
      "device_id": "AHU-4",
      "zone": "Zone-4",
      "ts": "2026-10-01T10:52:00Z",
      "zone_temp_c": 23.01,
      "supply_temp_c": 15.22,
      "setpoint_c": 23.0,
      "humidity_pct": 53.1,
      "airflow_cfm": 2237.0,
      "fan_speed_pct": 75.0,
      "power_kw": 6.23,
      "occupancy": 22,
      "co2_ppm": 1165.0,
      "status": "ON",
      "outdoor_temp_c": 36.5
    },
    {
      "device_id": "AHU-4",
      "zone": "Zone-4",
      "ts": "2026-10-01T10:53:00Z",
      "zone_temp_c": 22.87,
      "supply_temp_c": 15.33,
      "setpoint_c": 23.0,
      "humidity_pct": 55.2,
      "airflow_cfm": 2296.0,
      "fan_speed_pct": 75.0,
      "power_kw": 6.06,
      "occupancy": 21,
      "co2_ppm": 1152.0,
      "status": "ON",
      "outdoor_temp_c": 36.5
    },
    {
      "device_id": "AHU-4",
      "zone": "Zone-4",
      "ts": "2026-10-01T10:54:00Z",
      "zone_temp_c": 22.97,
      "supply_temp_c": 15.48,
      "setpoint_c": 23.0,
      "humidity_pct": 55.9,
      "airflow_cfm": 2260.0,
      "fan_speed_pct": 75.0,
      "power_kw": 6.17,
      "occupancy": 23,
      "co2_ppm": 1159.0,
      "status": "ON",
      "outdoor_temp_c": 36.9
    },
    {
      "device_id": "AHU-4",
      "zone": "Zone-4",
      "ts": "2026-10-01T10:55:00Z",
      "zone_temp_c": 23.01,
      "supply_temp_c": 14.83,
      "setpoint_c": 23.0,
      "humidity_pct": 54.4,
      "airflow_cfm": 2260.0,
      "fan_speed_pct": 75.0,
      "power_kw": 6.21,
      "occupancy": 22,
      "co2_ppm": 1139.0,
      "status": "ON",
      "outdoor_temp_c": 36.5
    },
    {
      "device_id": "AHU-4",
      "zone": "Zone-4",
      "ts": "2026-10-01T10:56:00Z",
      "zone_temp_c": 23.03,
      "supply_temp_c": 14.83,
      "setpoint_c": 23.0,
      "humidity_pct": 54.2,
      "airflow_cfm": 2262.0,
      "fan_speed_pct": 75.0,
      "power_kw": 6.38,
      "occupancy": 23,
      "co2_ppm": 1155.0,
      "status": "ON",
      "outdoor_temp_c": 36.5
    },
    {
      "device_id": "AHU-4",
      "zone": "Zone-4",
      "ts": "2026-10-01T10:57:00Z",
      "zone_temp_c": 23.07,
      "supply_temp_c": 15.53,
      "setpoint_c": 23.0,
      "humidity_pct": 53.6,
      "airflow_cfm": 2242.0,
      "fan_speed_pct": 75.0,
      "power_kw": 5.95,
      "occupancy": 22,
      "co2_ppm": 1149.0,
      "status": "ON",
      "outdoor_temp_c": 36.6
    },
    {
      "device_id": "AHU-4",
      "zone": "Zone-4",
      "ts": "2026-10-01T10:58:00Z",
      "zone_temp_c": 23.11,
      "supply_temp_c": 14.24,
      "setpoint_c": 23.0,
      "humidity_pct": 52.4,
      "airflow_cfm": 2246.0,
      "fan_speed_pct": 75.0,
      "power_kw": 6.63,
      "occupancy": 23,
      "co2_ppm": 1135.0,
      "status": "ON",
      "outdoor_temp_c": 36.6
    },
    {
      "device_id": "AHU-4",
      "zone": "Zone-4",
      "ts": "2026-10-01T10:59:00Z",
      "zone_temp_c": 22.98,
      "supply_temp_c": 15.73,
      "setpoint_c": 23.0,
      "humidity_pct": 53.5,
      "airflow_cfm": 2188.0,
      "fan_speed_pct": 75.0,
      "power_kw": 6.0,
      "occupancy": 24,
      "co2_ppm": 1149.0,
      "status": "ON",
      "outdoor_temp_c": 36.6
    },
    {
      "device_id": "AHU-4",
      "zone": "Zone-4",
      "ts": "2026-10-01T11:00:00Z",
      "zone_temp_c": 22.92,
      "supply_temp_c": 15.89,
      "setpoint_c": 23.0,
      "humidity_pct": 55.0,
      "airflow_cfm": 2267.0,
      "fan_speed_pct": 75.0,
      "power_kw": 6.03,
      "occupancy": 24,
      "co2_ppm": 1147.0,
      "status": "ON",
      "outdoor_temp_c": 36.4
    },
    {
      "device_id": "AHU-4",
      "zone": "Zone-4",
      "ts": "2026-10-01T11:01:00Z",
      "zone_temp_c": 23.01,
      "supply_temp_c": 14.61,
      "setpoint_c": 23.0,
      "humidity_pct": 54.7,
      "airflow_cfm": 2234.0,
      "fan_speed_pct": 75.0,
      "power_kw": 6.3,
      "occupancy": 24,
      "co2_ppm": 1146.0,
      "status": "ON",
      "outdoor_temp_c": 36.9
    },
    {
      "device_id": "AHU-4",
      "zone": "Zone-4",
      "ts": "2026-10-01T11:02:00Z",
      "zone_temp_c": 22.96,
      "supply_temp_c": 15.14,
      "setpoint_c": 23.0,
      "humidity_pct": 55.1,
      "airflow_cfm": 2145.0,
      "fan_speed_pct": 75.0,
      "power_kw": 6.18,
      "occupancy": 24,
      "co2_ppm": 1170.0,
      "status": "ON",
      "outdoor_temp_c": 36.7
    },
    {
      "device_id": "AHU-4",
      "zone": "Zone-4",
      "ts": "2026-10-01T11:03:00Z",
      "zone_temp_c": 22.99,
      "supply_temp_c": 15.03,
      "setpoint_c": 23.0,
      "humidity_pct": 56.2,
      "airflow_cfm": 2092.0,
      "fan_speed_pct": 75.0,
      "power_kw": 6.15,
      "occupancy": 23,
      "co2_ppm": 1171.0,
      "status": "ON",
      "outdoor_temp_c": 36.4
    },
    {
      "device_id": "AHU-4",
      "zone": "Zone-4",
      "ts": "2026-10-01T11:04:00Z",
      "zone_temp_c": 23.0,
      "supply_temp_c": 14.82,
      "setpoint_c": 23.0,
      "humidity_pct": 53.6,
      "airflow_cfm": 2058.0,
      "fan_speed_pct": 75.0,
      "power_kw": 6.28,
      "occupancy": 24,
      "co2_ppm": 1165.0,
      "status": "ON",
      "outdoor_temp_c": 37.0
    },
    {
      "device_id": "AHU-4",
      "zone": "Zone-4",
      "ts": "2026-10-01T11:05:00Z",
      "zone_temp_c": 22.95,
      "supply_temp_c": 15.02,
      "setpoint_c": 23.0,
      "humidity_pct": 54.7,
      "airflow_cfm": 1945.0,
      "fan_speed_pct": 75.0,
      "power_kw": 6.1,
      "occupancy": 24,
      "co2_ppm": 1172.0,
      "status": "ON",
      "outdoor_temp_c": 36.7
    },
    {
      "device_id": "AHU-4",
      "zone": "Zone-4",
      "ts": "2026-10-01T11:06:00Z",
      "zone_temp_c": 23.14,
      "supply_temp_c": 14.33,
      "setpoint_c": 23.0,
      "humidity_pct": 54.5,
      "airflow_cfm": 1921.0,
      "fan_speed_pct": 75.0,
      "power_kw": 6.2,
      "occupancy": 24,
      "co2_ppm": 1207.0,
      "status": "ON",
      "outdoor_temp_c": 36.6
    },
    {
      "device_id": "AHU-4",
      "zone": "Zone-4",
      "ts": "2026-10-01T11:07:00Z",
      "zone_temp_c": 22.98,
      "supply_temp_c": 15.35,
      "setpoint_c": 23.0,
      "humidity_pct": 55.0,
      "airflow_cfm": 1823.0,
      "fan_speed_pct": 75.0,
      "power_kw": 5.73,
      "occupancy": 24,
      "co2_ppm": 1198.0,
      "status": "ON",
      "outdoor_temp_c": 36.8
    },
    {
      "device_id": "AHU-4",
      "zone": "Zone-4",
      "ts": "2026-10-01T11:08:00Z",
      "zone_temp_c": 22.84,
      "supply_temp_c": 13.81,
      "setpoint_c": 23.0,
      "humidity_pct": 54.6,
      "airflow_cfm": 1779.0,
      "fan_speed_pct": 75.0,
      "power_kw": 6.51,
      "occupancy": 24,
      "co2_ppm": 1203.0,
      "status": "ON",
      "outdoor_temp_c": 36.9
    }
  ]
}